id,title,author,available,isbn13,price,format,publisher,pubdate,subjects,pages,overview
149,Thom Pain (based on nothing),Will Eno,1,9780822220763,$10.18,Paperback,"Dramatists Play Service, Incorporated",November 2005,"Scenes and Monologues, Drama Anthologies, American Drama, American Literature Anthologies, Theater - General & Miscellaneous",32," “Astonishing in its impact. . . . One of the treasured nights in the theatre that can leave you both breathless with exhilaration and, depending on your sensitivity to meditations on the bleak and beautiful mysteries of human experience, in a puddle of tears . . . <i>Thom Pain</i> is at bottom a surreal meditation on the empty promises life makes, the way experience never lives up to the weird and awesome fact of being. But it is also, in its odd, bewitching beauty, an affirmation of life’s worth.”—Charles Isherwood, <i>The New York Times</i></p>
 “Eno has emerged as one of the most original young playwrights on the scene. He is one of the few writers who can convert discomfort and outright agony into such pleasure.”—David Cote, <i>TimeOut New York</i></p>
 “Will Eno is one of the finest younger playwrights I’ve come across in a number of years. His work is inventive, disciplined and, at the same time, wild and evocative.”—Edward Albee</p>
 When Will Eno’s one-person play <i>Thom Pain</i> opened in New York in February 2005, it became something rare—an unqualified <i>hit</i>, which soon extended through July. Before that, the play was a critical success in London and received the coveted Fringe First Award at the Edinburgh Festival. Dubbed “stand-up existentialism” by <i>The New York Times</i>, it is lyrical and deadpan, both sardonic and sincere. It is Thom Pain—in the camouflage of the common man—fumbling with his heart, squinting into the light.</p>
 <b>Will Eno</b> lives in Brooklyn, New York. His plays include <i>The Flu Season</i>, <i>Tragedy: a tragedy</i>, <i>King: a problem play</i>, and <i>Intermission</i>. His plays have been produced in London by the Gate Theatre and BBC Radio, and in the United States by Rude Mechanicals and Naked Angels. His play <i>The Flu Season</i> recently won the Oppenheimer Award, presented by <i>NY Newsday</i> for the previous year’s best debut production in New York by an American playwright.</p>"
150,Death Blossoms: Reflections from a Prisoner of Conscience,Mumia Abu-Jamal,1,9780896086999,$12.00,Paperback,South End Press,July 2003,"Biographies &amp; Autobiographies, General",,
151,"B. O. O. B. S.: A Bunch of Outrageous Breast-Cancer Survivors Tell Their Stories of Courage, Hope and Healing",Ann Kempner Fisher,1,9781581825237,$13.50,Paperback,Turner Publishing Company,January 2006,"Women's Diseases & Disorders, Cancer, Cancer Patients - Biography, Women's Biography - General & Miscellaneous, American Literature Anthologies",336,"They are not just statistics or case studies, nor are they “genetic mishaps.” They are everyday modern women struggling to survive breast cancer. They share the same diagnosis but are a crazy-quilt of many patterns and colors, with ages spanning twenty-five years. Some of them are wives and mothers, grandmothers, and great-grandmothers; some are single, others divorced. They have different religious backgrounds, different occupations, different lifestyles, different values, and different treatments. But despite their differences, they all are <i>B.O.O.B.S.</i> 
 <i>B.O.O.B.S.</i> shares the personal experiences of ten courageous women—from shocking diagnosis to surgery and beyond—and the effect breast cancer has had on them and on the people in their lives. Brought together by the Wellness Community, a program offering cost-free psychological support to cancer patients and their loved ones, the ten women in this book strongly believe in the healing power of group therapy and peer sharing. Some of them have even become patient advocates and spokeswomen in a quest to make a difference in the lives of other women coping with breast cancer, a disease that strikes more than 200,000 women every year in the United States.</p>
 Written with insight, humor, raw emotion, and honesty, <i>B.O.O.B.S.</i> offers hope to women facing breast cancer. It also offers families and friends insights into what their loved ones are going through.</p>"
152,Becoming Americans: Four Centuries of Immigrant Writing,Ilan Stavans,1,9781598530513,$40.00,Hardcover,Library of America,October 2009,"Immigrants, Immigrants - Writings & Literature, Literature Anthologies - General & Miscellaneous, American Literature Anthologies",850,"Immigration is the essential American story. From London or Lvov, Bombay or Beijing, Dublin or Dusseldorf, people have come to America to remake themselves, their lives, and their identities. Despite political obstacles, popular indifference, or hostility, they put down roots here, and their social, cultural, and entrepreneurial energies helped forge the open and diverse society we live in. <br>
 The history of American immigration has often been told by those already here. <i>Becoming Americans</i> tells this epic story from the inside, gathering for the first time over 400 years of writing-from 17th-century Jamestown to contemporary Brooklyn and Los Angeles-by first-generation immigrants about the immigrant experience. In sum, over 80 writers create a vivid, passionate, and revealing firsthand account of the challenges and aspirations that define our dynamic, multicultural democracy.<br>
 In nearly a hundred entries-poems, stories, novel excerpts, travel pieces, diary entries, memoirs, and letters-<i>Becoming Americans</i> presents the full range of the experience of coming to America: the reasons for departure, the journey itself, the shock and spectacle of first arrival, the passionate ambivalence toward the old country and the old life, and above all the struggle with the complexities of America. Arranged in chronological order by date of arrival, this unprecedented collection presents a collective history of the United States that is both familiar and surprisingly new, as seen through the fresh eyes and words of newcomers from more than forty different countries.
 Features:<b>Ayuba Suleiman Diallo, Gottlieb Mittelberger, St. John de Crèvecoeur, Phillis Wheatley, Lorenzo Da Ponte, John James Audubon, Fanny Kemble, Jacob Riis, Abraham Cahan, O. E. Rølvaag, Henry Roth, Claude McKay, Charles Chaplin, Felipe Alfau, Carlos Bulosan, Isaac Bashevis Singer, Vladimir Nabokov, W. H. Auden, Frank McCourt, Edward Said, Charles Simic, Julia Alvarez, Czeslaw Milosz, Luc Sante, Eva Hoffman, Jamaica Kincaid, Chang-rae Lee, Jhumpa Lahiri, Joseph Brodsky, Junot Díaz, Gary Shteyngart, Dinaw Mengestu, Edwidge Danticat, Norman Manea, Anita Desai, Lara Vapnyar, Richard Rodriguez, and many more...</b></p>"
153,Dream Me Home Safely: Writers on Growing Up in America,Susan Richards Shreve,1,9780618379026,$14.47,Paperback,Houghton Mifflin Harcourt,October 2003,"U.S. Authors - 20th Century - Literary Biography, 20th Century American History - Social Aspects - General & Miscellaneous, Childhood Memoirs & Biography, Self-Improvement, American Literature Anthologies",238," In the title essay of this extraordinary keepsake of childhood in America, John Edgar Wideman pays fierce tribute to a complex mother who ""used to dream me home safely by sitting up and waiting for me to stumble in."" The young writer Bich Minh Nguyen remembers arriving in Michigan from Vietnam in 1975 and a classmate who said, ""Your house smells funny,"" and Michael Parker recalls a sister's vivid—and hilarious—act of defiance on a particular North Carolina evening in 1971. These and many more intensely intimate memories make Dream Me Home Safely a collection as diverse and powerful as all of American letters.</p>"
154,The Best American Short Stories 2005,Michael Chabon,1,9780618427055,$17.98,Paperback,Houghton Mifflin Harcourt,October 2005,"American Fiction, Short Story Collections (Single Author), Short Story Anthologies, American Literature Anthologies",432," The Best American Series First, Best, and Best-Selling</p>
 The Best American series has been the premier annual showcase for the country's finest short fiction and nonfiction since 1915. Each volume's series editor selects notable works from hundreds of periodicals. A special guest editor, a leading writer in the field, then chooses the very best twenty or so pieces to publish. This unique system has made the Best American series the most respected—and most popular—of its kind.</p>
 The Best American Short Stories 2005 includes</p>
 Dennis Lehane  Tom Perrotta  Alice Munro  Edward P. Jones  Joy Williams  Joyce Carol Oates  Thomas McGuane  Kelly Link  Charles D'Ambrosio  Cory Doctorow  George Saunders  and others</p>
 Michael Chabon, guest editor, is the best-selling author of The Mysteries of Pittsburgh, Wonder Boys, A Model World, and, most recently, The Final Solution. His novel The Amazing Adventures of Kavalier and Clay won the Pulitzer Prize in 2000.</p>"
155,The Stuffed Owl: An Anthology of Bad Verse,D.B. Wyndham Lewis,1,9781590170380,$18.19,Paperback,New York Review of Books,March 2003,"Poetry Anthologies, American Poetry, English Poetry, English & Irish Literature Anthologies, American Literature Anthologies",264,"The editors of this legendary and hilarious anthology write: ""It would seem at a hasty glance that to make an anthology of Bad Verse is on the whole a simple matter . . . On the contrary . . . Bad Verse has its canons, like Good Verse. There is bad Bad Verse and good Bad Verse. It has been the constant preoccupation of the compilers to include in this book chiefiy good Bad Verse."" Here indeed one finds the best of the worst of the greatest poets of the English language, masterpieces of the maladroit by Dryden, Wordsworth, and Keats, among many others, together with an index (""Maiden, feathered, uncontrolled appetites of, 59;. . . Manure, adjudged a fit subject for the Muse, 91"") that is itself an inspired work of folly."
156,"The American Tradition in Literature, Volume 2 (book alone)",George Perkins,1,9780077239053,$104.07,Paperback,"McGraw-Hill Companies, The",October 2008,American Literature Anthologies,2160," Widely known as the anthology that best unites tradition with innovation, The American Tradition in Literature is proud to enter its fifth decade of leadership among textbook anthologies of American literature.</p>
 Each volume continues to offer a flexible organization, with literary merit as the guiding principle of selection. The new photos and illustrations illuminate the texts and literary/historical timelines help students put works in context.</p>"
157,American Working-Class Literature: An Anthology,Nicholas Coles,1,9780195144567,$57.22,Paperback,"Oxford University Press, USA",August 2006,"Literature Anthologies - General & Miscellaneous, American Literature Anthologies",960," America's workers have been singing, reciting, performing, telling stories, writing, and publishing for more than three centuries. Ranging from early colonial times to the present, American Working-Class Literature presents more than 300 literary texts that exemplify this tradition. It demonstrates how American working people live, labor, struggle, express themselves, and give meaning to their experiences both inside and outside of the workplace. The only book of its kind, this groundbreaking anthology includes work not only by the industrial proletariat but also by slaves and unskilled workers, by those who work unpaid at home, and by workers in contemporary service industries. As diverse in race, gender, culture, and region as America's working class itself, the selections represent a wide range of genres including fiction, poetry, drama, memoir, oratory, journalism, letters, oral history, and songs. Works by little-known or anonymous authors are included alongside texts from such acclaimed writers as Frederick Douglass, Upton Sinclair, Tillie Olsen, Philip Levine, Maxine Hong Kingston, and Leslie Marmon Silko. A rich selection of contemporary writing includes Martin Espada's poem ""Alabanza"" about the September 11, 2001, attack on the World Trade Center.<br>
 American Working-Class Literature is organized chronologically into seven sections that highlight key historical and cultural developments in working-class life. The book is enhanced by an editors' introduction, section introductions, and individual head notes for each selection that provide biographical and historical context. A timeline of working-class history, rich illustrations, sidebars, reading lists, and a bibliography of critical commentary are also included. This unique volume is ideal for courses in American literature, cultural and working-class studies, and labor history.</p>"
158,The Butterfly's Way: Voices from the Haitian Dyaspora in the United States,Edwidge Danticat,1,9781569472187,$11.43,Paperback,"Soho Press, Incorporated",July 2003,American Literature Anthologies,280,"In four sections—Childhood, Migration, First Generation, and Return—the contributors to this anthology write powerfully, often hauntingly, of their lives in Haiti and the United States. Jean-Robert Cadet's description of his Haitian childhood as a restavec—a child slave—in Port-au-Prince contrasts with Dany Laferriere's account of a ten-year-old boy and his beloved grandmother in Petit-Gove. We read of Marie Helene Laforest's realization that while she was white in Haiti, in the United States she is black. Patricia Benoit tells us of a Haitian woman refugee in a detention center who has a simple need for a red dress—dignity. The reaction of a man who has married the woman he loves is the theme of Gary Pierre-Pierre's ""The White Wife""; the feeling of alienation is explored in ""Made Outside"" by Francie Latour. The frustration of trying to help those who have remained in Haiti and of the do-gooders who do more for themselves than the Haitians is described in Babette Wainwright's ""Do Something for Your Soul, Go to Haiti."" The variations and permutations of the divided self of the Haitian emigrant are poignantly conveyed in this unique anthology."
159,Bedford Anthology of American Literature: Volume Two: 1865 to Present,Susan Belasco,1,9780312412081,$59.78,Paperback,Bedford/St. Martin's,February 2008,American Literature Anthologies,1632,"<br>
Prepared by recognized scholars and devoted teachers, <i>The Bedford Anthology of American Literature</i> brings the canon of American literature down to a manageable size. Half the length of other leading anthologies, and offered at a much lower price, the anthology reflects years of firsthand experience in the classroom and extensive research on what instructors are actually teaching in the survey course today. Prepared expressly for students and informed by the new understandings of and approaches to American literature that have emerged during the last 30 years, the anthology is lavishly illustrated and features several pedagogical innovations that help students engage with the literature."
160,"Titanica: The Disaster of the Century in Poetry, Song and Prose",Steven Biel,1,9780393318739,$11.00,Paperback,"Norton, W. W. & Company, Inc.",September 1998,"Literature Anthologies - General & Miscellaneous, American Literature Anthologies",128," Now Steven Biel, author of the acclaimed <b>Down with the Old Canoe</b>, has gathered some of the most telling of our culture's responses to this unparalleled tragedy, creating an invaluable sourcebook for anyone who wants to discover first-hand what people made of it, both then and now. Biel is today's best-known authority on the place of the <b>Titanic</b> in American culture, and this book's unique appeal—inviting both the generally curious reader to browse its pages, and rewarding <b>Titanic</b> buffs with many authentic gems—makes it a standout in the <b>Titanic</b> literature.</p>"
161,The Unswept Path: Contemporary American Haiku,John Brandi,1,9781893996380,$15.00,Paperback,White Pine Press,September 2005,"Poetry, Anthologies (multiple authors)",,
162,"The Vietnam War in American Stories, Songs, and Poems",H. Bruce Franklin,1,9780312115524,$18.75,Paperback,Bedford/St. Martin's,August 1995,American Literature Anthologies,343,"<br>
The first college anthology of American literature about the Vietnam War brings together 16 stories, 5 songs, and 63 poems in an affordable text for literature and history courses."
163,The Best American Essays 2008,Adam Gopnik,1,9780618983223,$11.92,Paperback,Houghton Mifflin Harcourt,October 2008,"American Essays, American Literature Anthologies",320,"Edited by The New Yorker's much-loved Adam Gopnik, this year's Best American Essays continues the laudable tradition of collecting the finest essays, ""judiciously selected from countless publications"" (Chicago Tribune), ensuring that the 2008 edition is another ""kick-ass anthology"" (Booklist).<br>
<br>
Contributors include Albert Goldbarth, Anthony Lane, Louis Menand, Ander Monson, and others."
164,The Best American Poetry 2008,Charles Wright,1,9780743299756,$16.00,Paperback,Simon & Schuster Adult Publishing Group,September 2008,"Poetry Anthologies, American Poetry, American Literature Anthologies",224,"<br>
The <i>Best American Poetry</i> series is a beloved mainstay of American poetry. This year's edition was edited by one of the most admired and acclaimed poets of his generation, Charles Wright. Known for his meditative and beautiful observations of landscape, change, and time, Wright brings his particular sensibility to this year's anthology, which contains an ecumenical slant that is unprecedented for the series. He has gathered an astonishing selection of work that includes new poems by Carolyn Forché, Jorie Graham, Louise Glück, Frank Bidart, Frederick Seidel, Patti Smith, and Kevin Young and showcases a dazzling array of rising stars like Joshua Beckman, Erica Dawson, and Alex Lemon.<br>
With captivating and revelatory notes from the poets on their works and sage and erudite introductory essays by Wright and series editor David Lehman, <i>The Best American Poetry 2008</i> will be read, discussed, debated, and prized for years to come.<br>"
165,Poems from the Women's Movement,Honor Moore,1,9781598530421,$18.88,Hardcover,Library of America,April 2009,"Poetry, American Literature Anthologies, Anthologies",200,"THE WOMEN'S MOVEMENT OF THE 1960s, 70s, AND 80s generated an extraordinary outpouring of poetry that captured an age of expectancy, of defiant purpose, and exuberant exploration. Here, brought together for the first time, are the poems that gave voice to a revolution, including works by Sylvia Plath, Adrienne Rich, Muriel Rukeyser, Anne Sexton, Sonia Sanchez, Lucille Clifton, May Swenson, Alice Walker, Anne Waldman, Sharon Olds, and many others."
166,Listening for God: Contemporary Literature And The Life Of Faith: Volume 2,Paula J. Carlson,1,9780806628448,$13.43,Paperback,"Augsburg Fortress, Publishers",January 1998,"Faith, Literature Anthologies - General & Miscellaneous, Religious Inspiration - General, General & Miscellaneous Christian Life, American Literature Anthologies",160,"Never before has a resource touched upon the issues of life and faith in such a personal way. Excellent contemporary literature helps one realize the presence of God in many places and relationships. Each volume of <i>Listening for God</i> includes excerpts from the works of eight contemporary authors, supplemented by author profiles and reflection questions. A Leader Guide, offering suggestions for organizing class time and responding to reflection questions is also available."
167,The Norton Anthology of African American Literature,Henry Louis Gates Jr.,1,9780393040012,$59.95,Hardcover,"Norton, W. W. & Company, Inc.",November 1996,"Literary Collections, Latin American",,
168,The Best American Sports Writing 2008,William Nack,1,9781615580194,,Paperback,Houghton Mifflin Harcourt,October 2008,,,
169,New Orleans Stories: Great Writers on the City,John Miller,1,9780811844949,$1.99,Paperback,Chronicle Books LLC,June 2004,"Urban Sociology, American Literature Anthologies",224,"Voodoo. Vampires. Jazz. There's no city quite like New Orleans, a city that whispers stories and where writers come to eavesdrop. <i>New Orleans Stories</i> collects the very best writing on the Big Easy by a stellar gallery of writers for whom the city has played host and muse -- from Walt Whitman and William Faulkner to Anne Rice, Truman Capote, Walker Percy, Tennessee Williams, and Zora Neale Hurston. With a striking new cover, this anthology captures the vibrancy -- and variety -- of New Orleans as it casts its most seductive spell."
170,Sporting Lives: Metaphor and Myth in American Sports,James W. Pipkin,1,9780826217790,$28.75,Hardcover,University of Missouri Press,February 2008,"Regional Sports, Sport Figures - General & Miscellaneous - Biography, Athletics - General & Miscellaneous, American Literature Anthologies",184," Sometimes the crack of the bat or the roar of the crowd fails to capture the meaning of sports as athletes themselves understand it. Books about sports have ignored this dimension of the subject, particularly the athletes’ own autobiographical accounts. &nbsp;In <i>Sporting Lives</i>, &nbsp;the first book to examine the two popular realms of sports and autobiography, James Pipkin looks at recurring patterns found in athletes’ accounts of their lives and sporting experiences, examining language, metaphor, rhetorical strategies, and other elements to analyze sports from the inside out.</p>
 <i>Sporting Lives</i> takes a fresh look at memoirs from baseball, football, basketball, golf, and other sports to explore how American athletes see themselves: not only how those images mesh with popular perceptions of them as heroes or celebrities but also how their accounts differ from those of sports journalists and other outsiders. Drawing on the life stories of such well-known figures as Wilt Chamberlain, Babe Ruth, and Martina Navratilova—both as-told-to and self-authored works—Pipkin follows players from the “echoing green” of eternal youth to the sometimes cultlike and isolated status of fame, interpreting recurring patterns both in the living of their lives and in the telling of them. He even considers Dennis Rodman’s four autobiographies to show how the contradictions of his self-portrayals reflect the Janus-faced quality of sports in the era of celebrity culture.</p>
 As Pipkin shows, the life of the athlete involves more than mere athleticism; it is also a world of nostalgia and sentiment, missed opportunities and lost youth. He sheds light on athletes’ common obsession with youth and body image—including gender and racial considerations—and explores their descriptions of being “in a zone,” that transcendent state when everything seems to click. And he considers the time that all athletes dread, when their bodies begin to betray them . . . and the cheering stops.</p>
 While the lives of athletes may often suggest the magic of Peter Pan, Pipkin’s engaging study reveals that they are in many ways more like the Lost Boys. <i>Sporting Lives</i> shows that the meaning of sports is intertwined with the telling. It is both an eminently readable book for fans and a critically sophisticated analysis that will engage scholars of literature, sports or media studies, and American popular culture.</p>"
171,"American Literature, Volume II (Penguin Academics Series)",William E. Cain,1,9780321116246,$42.93,Paperback,Longman,December 2003,American Literature Anthologies,1584," As part of the Penguin Academic series, <i>American Literature</i> offers a wide range of selections with minimal editorial apparatus at an affordable price.</p>"
172,After Frost: Anthol Poetry From N E,Henry Lyman,1,9781558490413,$22.03,Paperback,University of Massachusetts Press,September 1996,"Poetry Anthologies, American Poetry, American Literature Anthologies",240,"Robert Frost has long dominated the public's image of New England poetry, but who are the poets who follow him in time and how have they expressed their visions of the landscape, the individual, and the community? This volume brings together the work of thirty distinguished poets to convey the vitality and variety of the region's poetic creation during much of the twentieth century. Henry Lyman has selected the poets, arranged their work chronologically by birth date, and written a brief preface to each section. The anthology is by no means comprehensive, nor is it an attempt to establish a ""canon"" of New England poets. Rather it is simply a selection of notable poems chosen for their clarity, depth, and common ground. The poems converse with each other from page to page, resulting in a cohesive, eminently readable text. For the student or general reader, there is no better introduction to the range and richness of New England poetry."
173,"To The Shore Once More, Volume II: A Journey Down The Jersey Shore; Prose, Poetry, And Works Of Art",Frank Finale,1,9780963290625,$48.00,Hardcover,Jersey Shore Publications,May 2001,Literary Collections,,
